{
  "schema_version": 1,
  "default_phase_profile": "base",
  "profiles": {
    "base": {
      "phases": [
        "planning",
        "planning-approval",
        "execution",
        "verify",
        "review",
        "ready",
        "retro"
      ]
    }
  },
  "stack_overrides": {},
  "risk_overrides": {
    "high": {
      "phase_profile": "base",
      "review_profile": "strict"
    },
    "medium": {
      "phase_profile": "base",
      "review_profile": "standard"
    },
    "low": {
      "phase_profile": "base",
      "review_profile": "light"
    }
  }
}
